{
  "schemaVersion": 1,
  "id": "nws-us-weather",
  "registryName": "io.github.cyanheads/nws-weather-mcp-server",
  "title": "nws-weather-mcp-server",
  "description": "Get US weather forecasts, active alerts, and current observations.",
  "version": "0.9.1",
  "classification": {
    "isDataService": true,
    "domains": [
      "geospatial",
      "public"
    ],
    "matchedKeywords": [
      "weather"
    ]
  },
  "source": {
    "kind": "official-mcp-registry",
    "apiUrl": "https://registry.modelcontextprotocol.io/v0.1/servers",
    "detailUrl": "https://registry.modelcontextprotocol.io/v0.1/servers/io.github.cyanheads%2Fnws-weather-mcp-server/versions/0.9.1",
    "status": "active",
    "publishedAt": "2026-08-25T07:13:32.888883Z",
    "updatedAt": "2026-08-25T07:13:32.888883Z",
    "retrievedAt": "2026-08-31T05:39:33.291Z"
  },
  "officialLinks": {
    "websiteUrl": null,
    "repository": {
      "url": "https://github.com/cyanheads/nws-weather-mcp-server",
      "source": "github",
      "id": null,
      "subfolder": null
    }
  },
  "transports": [
    {
      "kind": "package",
      "type": "stdio",
      "url": null,
      "package": {
        "registryType": "npm",
        "identifier": "@cyanheads/nws-weather-mcp-server",
        "version": "0.9.1"
      }
    },
    {
      "kind": "package",
      "type": "streamable-http",
      "url": null,
      "package": {
        "registryType": "npm",
        "identifier": "@cyanheads/nws-weather-mcp-server",
        "version": "0.9.1"
      }
    },
    {
      "kind": "remote",
      "type": "streamable-http",
      "url": "https://nws.caseyjhand.com/mcp",
      "package": null
    }
  ],
  "authentication": {
    "mode": "none",
    "requiredHeaders": [],
    "reason": "维护者文档明确 NWS API 为 zero-auth，公开托管端点无需用户 API Key；只读预警类型查询已通过。"
  },
  "license": {
    "status": "declared",
    "spdxId": "Apache-2.0",
    "evidenceUrl": "https://github.com/cyanheads/nws-weather-mcp-server/blob/main/LICENSE"
  },
  "maintenance": {
    "registryStatus": "active",
    "registryUpdatedAt": "2026-08-25T07:13:32.888883Z",
    "ageDays": 5,
    "repositoryActivity": "unknown"
  },
  "probe": {
    "status": "pass",
    "checkedAt": "2026-08-31T05:47:14.866Z",
    "targetUrl": "https://nws.caseyjhand.com/mcp",
    "httpStatus": 200,
    "reason": "MCP initialize returned a JSON-RPC or event-stream response."
  },
  "dedupe": {
    "level": "none",
    "strong": [],
    "weak": []
  },
  "score": {
    "total": 94,
    "band": "selected",
    "dimensions": {
      "authority": 20,
      "accessibility": 25,
      "maintenanceSecurity": 20,
      "runtime": 15,
      "marketGap": 10,
      "documentation": 4
    },
    "reasons": [
      "authority 20/25: Official Registry plus publisher links and namespace evidence",
      "accessibility 25/25: 1 remote and 2 package transport(s); auth none",
      "maintenance/security 20/20: status active; registry age 5 day(s); license declared",
      "runtime 15/15: public probe pass",
      "market gap 10/10: domains geospatial, public; dedupe none",
      "documentation 4/5: publisher-provided description and links"
    ],
    "gates": [
      "Human source and service-terms review is still required before a descriptor PR."
    ]
  },
  "review": {
    "decision": "pending",
    "proposedConnectorId": "nws-us-weather",
    "reviewedAt": null,
    "reviewedBy": null,
    "notes": "自动证据补全和脱敏运行预检已通过；仍待真实维护者复核社区项目身份、NWS 使用政策、天气安全免责声明与长期运维后批准。"
  },
  "runtimeAcceptance": {
    "status": "pass",
    "checkedAt": "2026-08-31T05:50:18.508Z",
    "reviewedBy": "codex-preflight",
    "reportUrl": "https://github.com/duhu2000/dsh-mcp-connector-registry/blob/main/docs/runtime-acceptance/data-mcp-batch-2/nws-us-weather.md",
    "notes": "脱敏预检通过 initialize、tools/list 和只读工具 nws_list_alert_types；未保存原始响应、会话标识或凭据。人工来源批准仍为待办。"
  },
  "evidence": [
    {
      "type": "official-registry",
      "url": "https://registry.modelcontextprotocol.io/v0.1/servers/io.github.cyanheads%2Fnws-weather-mcp-server/versions/0.9.1",
      "collectedAt": "2026-08-31T05:39:33.291Z",
      "summary": "Official Registry status active; version 0.9.1."
    },
    {
      "type": "official-repository",
      "url": "https://github.com/cyanheads/nws-weather-mcp-server",
      "collectedAt": "2026-08-31T05:39:33.291Z",
      "summary": "社区维护仓库记录 7 个只读工具和 1 个资源，查询美国 NWS 预报、警报、观测与预报讨论。"
    },
    {
      "type": "official-website",
      "url": "https://www.weather.gov/documentation/services-web-api",
      "collectedAt": "2026-08-31T05:52:00.000Z",
      "summary": "National Weather Service API 文档是实时美国天气数据的上游官方说明；覆盖范围、时效与安全用途免责声明需在卡片披露。"
    },
    {
      "type": "license",
      "url": "https://github.com/cyanheads/nws-weather-mcp-server/blob/main/LICENSE",
      "collectedAt": "2026-08-31T05:52:00.000Z",
      "summary": "io.github.cyanheads/nws-weather-mcp-server 源代码声明 Apache-2.0；上游数据授权、署名与使用条款仍需在人工批准时单独复核。"
    },
    {
      "type": "probe",
      "url": "https://nws.caseyjhand.com/mcp",
      "collectedAt": "2026-08-31T05:47:14.866Z",
      "summary": "公开无用户凭据的 MCP initialize 探测通过，HTTP 200。"
    },
    {
      "type": "runtime-acceptance",
      "url": "https://github.com/duhu2000/dsh-mcp-connector-registry/blob/main/docs/runtime-acceptance/data-mcp-batch-2/nws-us-weather.md",
      "collectedAt": "2026-08-31T05:50:18.508Z",
      "summary": "自动脱敏预检通过 nws_list_alert_types 只读调用；原始响应正文未落盘。"
    }
  ]
}
