{
  "schemaVersion": 1,
  "id": "bls-us-labour-statistics",
  "registryName": "io.github.cyanheads/bls-labor-mcp-server",
  "title": "bls-labor-mcp-server",
  "description": "Fetch US Bureau of Labor Statistics data — CPI, unemployment, wages, JOLTS, and more via MCP.",
  "version": "0.5.1",
  "classification": {
    "isDataService": true,
    "domains": [
      "public",
      "research"
    ],
    "matchedKeywords": [
      "statistics"
    ]
  },
  "source": {
    "kind": "official-mcp-registry",
    "apiUrl": "https://registry.modelcontextprotocol.io/v0.1/servers",
    "detailUrl": "https://registry.modelcontextprotocol.io/v0.1/servers/io.github.cyanheads%2Fbls-labor-mcp-server/versions/0.5.1",
    "status": "active",
    "publishedAt": "2026-08-31T02:57:10.313142Z",
    "updatedAt": "2026-08-31T02:57:10.313142Z",
    "retrievedAt": "2026-08-31T05:39:33.291Z"
  },
  "officialLinks": {
    "websiteUrl": null,
    "repository": {
      "url": "https://github.com/cyanheads/bls-labor-mcp-server",
      "source": "github",
      "id": null,
      "subfolder": null
    }
  },
  "transports": [
    {
      "kind": "package",
      "type": "stdio",
      "url": null,
      "package": {
        "registryType": "npm",
        "identifier": "@cyanheads/bls-labor-mcp-server",
        "version": "0.5.1"
      }
    },
    {
      "kind": "package",
      "type": "streamable-http",
      "url": null,
      "package": {
        "registryType": "npm",
        "identifier": "@cyanheads/bls-labor-mcp-server",
        "version": "0.5.1"
      }
    },
    {
      "kind": "remote",
      "type": "streamable-http",
      "url": "https://bls-labor.caseyjhand.com/mcp",
      "package": null
    }
  ],
  "authentication": {
    "mode": "none",
    "requiredHeaders": [],
    "reason": "公开托管端点无需用户凭据；自托管可选 BLS 注册 Key 仅用于提高上游配额，不是连接必需参数。"
  },
  "license": {
    "status": "declared",
    "spdxId": "Apache-2.0",
    "evidenceUrl": "https://github.com/cyanheads/bls-labor-mcp-server/blob/main/LICENSE"
  },
  "maintenance": {
    "registryStatus": "active",
    "registryUpdatedAt": "2026-08-31T02:57:10.313142Z",
    "ageDays": 0,
    "repositoryActivity": "unknown"
  },
  "probe": {
    "status": "pass",
    "checkedAt": "2026-08-31T05:47:14.865Z",
    "targetUrl": "https://bls-labor.caseyjhand.com/mcp",
    "httpStatus": 200,
    "reason": "MCP initialize returned a JSON-RPC or event-stream response."
  },
  "dedupe": {
    "level": "none",
    "strong": [],
    "weak": []
  },
  "score": {
    "total": 94,
    "band": "selected",
    "dimensions": {
      "authority": 20,
      "accessibility": 25,
      "maintenanceSecurity": 20,
      "runtime": 15,
      "marketGap": 10,
      "documentation": 4
    },
    "reasons": [
      "authority 20/25: Official Registry plus publisher links and namespace evidence",
      "accessibility 25/25: 1 remote and 2 package transport(s); auth none",
      "maintenance/security 20/20: status active; registry age 0 day(s); license declared",
      "runtime 15/15: public probe pass",
      "market gap 10/10: domains public, research; dedupe none",
      "documentation 4/5: publisher-provided description and links"
    ],
    "gates": []
  },
  "review": {
    "decision": "approved",
    "proposedConnectorId": "bls-us-labour-statistics",
    "reviewedAt": "2026-08-31T06:44:43Z",
    "reviewedBy": "DuHu",
    "notes": "DuHu 已逐项复核 Official Registry 身份、社区独立维护边界、公开端点、鉴权、服务端许可证、上游数据条款提示和脱敏运行报告，批准迁入正式记录并生成 Connector 卡片。"
  },
  "runtimeAcceptance": {
    "status": "pass",
    "checkedAt": "2026-08-31T05:50:14.742Z",
    "reviewedBy": "codex-preflight",
    "reportUrl": "https://github.com/duhu2000/dsh-mcp-connector-registry/blob/main/docs/runtime-acceptance/data-mcp-batch-2/bls-us-labour-statistics.md",
    "notes": "脱敏预检通过 initialize、tools/list 和只读工具 bls_list_surveys；未保存原始响应、会话标识或凭据。维护者 DuHu 已完成来源审核。"
  },
  "evidence": [
    {
      "type": "official-registry",
      "url": "https://registry.modelcontextprotocol.io/v0.1/servers/io.github.cyanheads%2Fbls-labor-mcp-server/versions/0.5.1",
      "collectedAt": "2026-08-31T05:39:33.291Z",
      "summary": "Official Registry status active; version 0.5.1."
    },
    {
      "type": "official-repository",
      "url": "https://github.com/cyanheads/bls-labor-mcp-server",
      "collectedAt": "2026-08-31T05:39:33.291Z",
      "summary": "社区维护仓库提供 6 个只读工具，查询美国 BLS 的 CPI、失业、工资和 JOLTS 等劳工统计。"
    },
    {
      "type": "official-website",
      "url": "https://www.bls.gov/developers/",
      "collectedAt": "2026-08-31T05:52:00.000Z",
      "summary": "美国劳工统计局 Public Data API 是上游官方来源；匿名与注册调用的配额差异需在卡片和运行说明中披露。"
    },
    {
      "type": "license",
      "url": "https://github.com/cyanheads/bls-labor-mcp-server/blob/main/LICENSE",
      "collectedAt": "2026-08-31T05:52:00.000Z",
      "summary": "io.github.cyanheads/bls-labor-mcp-server 源代码声明 Apache-2.0；上游数据授权、署名与使用条款仍需在人工批准时单独复核。"
    },
    {
      "type": "probe",
      "url": "https://bls-labor.caseyjhand.com/mcp",
      "collectedAt": "2026-08-31T05:47:14.865Z",
      "summary": "公开无用户凭据的 MCP initialize 探测通过，HTTP 200。"
    },
    {
      "type": "runtime-acceptance",
      "url": "https://github.com/duhu2000/dsh-mcp-connector-registry/blob/main/docs/runtime-acceptance/data-mcp-batch-2/bls-us-labour-statistics.md",
      "collectedAt": "2026-08-31T05:50:14.742Z",
      "summary": "自动脱敏预检通过 bls_list_surveys 只读调用；原始响应正文未落盘。"
    }
  ]
}
