{
  "schemaVersion": 1,
  "id": "shopline-developer-mcp",
  "registryName": "npm:@shoplineos/shopline-developer-mcp",
  "title": "SHOPLINE Developer MCP",
  "description": "Official SHOPLINE stdio MCP for searching developer documentation, inspecting Admin REST API definitions and Storefront GraphQL schemas, and validating GraphQL code.",
  "version": "1.1.0",
  "classification": {
    "isDataService": false,
    "domains": [
      "developer-tools",
      "ecommerce"
    ],
    "matchedKeywords": [
      "api",
      "developer documentation",
      "graphql",
      "shopline"
    ]
  },
  "source": {
    "kind": "official-vendor",
    "apiUrl": null,
    "detailUrl": "https://developer.shopline.com/docs/apps/development-tool/shopline-developer-mcp/",
    "status": "active",
    "publishedAt": null,
    "updatedAt": null,
    "retrievedAt": "2026-09-11T03:25:42Z"
  },
  "officialLinks": {
    "websiteUrl": "https://developer.shopline.com/docs/apps/development-tool/shopline-developer-mcp/",
    "repository": null
  },
  "transports": [
    {
      "kind": "package",
      "type": "stdio",
      "url": null,
      "package": {
        "registryType": "npm",
        "identifier": "@shoplineos/shopline-developer-mcp",
        "version": "1.1.0"
      }
    }
  ],
  "authentication": {
    "mode": "none",
    "requiredHeaders": [],
    "reason": "SHOPLINE's official MCP documentation states that the stdio server runs locally and does not require authentication. The credential-free runtime acceptance passed."
  },
  "license": {
    "status": "declared",
    "spdxId": "MIT",
    "evidenceUrl": "https://registry.npmjs.org/@shoplineos%2Fshopline-developer-mcp/1.1.0"
  },
  "maintenance": {
    "registryStatus": "active",
    "registryUpdatedAt": null,
    "ageDays": null,
    "repositoryActivity": "unknown"
  },
  "probe": {
    "status": "pass",
    "checkedAt": "2026-09-11T03:25:42Z",
    "targetUrl": null,
    "httpStatus": null,
    "reason": "Credential-free stdio initialize returned SHOPLINE Developer MCP 1.1.0 with protocol version 2025-06-18."
  },
  "dedupe": {
    "level": "none",
    "strong": [],
    "weak": []
  },
  "score": {
    "total": 96,
    "band": "selected",
    "dimensions": {
      "authority": 25,
      "accessibility": 25,
      "maintenanceSecurity": 18,
      "runtime": 15,
      "marketGap": 8,
      "documentation": 5
    },
    "reasons": [
      "authority 25/25: SHOPLINE publishes the MCP launch configuration on its own developer domain and owns the npm namespace",
      "accessibility 25/25: version-pinned stdio package starts without credentials",
      "maintenance/security 18/20: MIT metadata and official package maintainer verified; no public source repository was declared",
      "runtime 15/15: initialize, tools/list, and a read-only documentation search passed",
      "market gap 8/10: adds official ecommerce developer documentation and API schema tooling",
      "documentation 5/5: official setup, usage examples, and tool inventory are public"
    ],
    "gates": []
  },
  "review": {
    "decision": "approved",
    "proposedConnectorId": "shopline-developer-mcp",
    "reviewedAt": "2026-09-11T04:16:25Z",
    "reviewedBy": "DuHu",
    "notes": "DuHu 已复核 SHOPLINE 官方文档、npm 包归属、免鉴权 stdio 配置、MIT 许可证元数据、版本固定策略、脱敏运行报告、服务端工具描述不可信边界与反馈工具的外部发送副作用，批准迁入正式记录并生成 Connector 卡片。"
  },
  "runtimeAcceptance": {
    "status": "pass",
    "checkedAt": "2026-09-11T03:25:42Z",
    "reviewedBy": "codex-preflight",
    "reportUrl": "https://github.com/duhu2000/dsh-mcp-connector-registry/blob/main/docs/runtime-acceptance/plugin-market-oauth-round-1/shopline-developer-mcp.md",
    "notes": "免凭据 stdio initialize 与 tools/list 返回 9 个工具，只读 search_shopline_docs 调用成功；未保留原始正文、会话标识或服务端日志。维护者 DuHu 已完成来源与安全边界审核。"
  },
  "evidence": [
    {
      "type": "official-vendor",
      "url": "https://developer.shopline.com/docs/apps/development-tool/shopline-developer-mcp/",
      "collectedAt": "2026-09-11T03:25:42Z",
      "summary": "SHOPLINE 官方开发者文档公开免鉴权 stdio 启动命令和完整的 9 个工具清单。"
    },
    {
      "type": "license",
      "url": "https://registry.npmjs.org/@shoplineos%2Fshopline-developer-mcp/1.1.0",
      "collectedAt": "2026-09-11T03:25:42Z",
      "summary": "npm Registry 中 1.1.0 版本元数据声明 MIT，并显示 shopline-developer 维护者身份。"
    },
    {
      "type": "runtime-acceptance",
      "url": "https://github.com/duhu2000/dsh-mcp-connector-registry/blob/main/docs/runtime-acceptance/plugin-market-oauth-round-1/shopline-developer-mcp.md",
      "collectedAt": "2026-09-11T03:25:42Z",
      "summary": "免凭据 stdio initialize、tools/list 和公开开发文档只读检索通过；原始响应未落盘。"
    }
  ]
}
