{
  "schemaVersion": 1,
  "id": "fred-economic-data",
  "registryName": "io.github.pipeworx-io/fred",
  "title": "Fred",
  "description": "FRED MCP — Federal Reserve Economic Data (St. Louis Fed)",
  "version": "0.1.0",
  "classification": {
    "isDataService": true,
    "domains": [
      "finance",
      "public",
      "research"
    ],
    "matchedKeywords": [
      "economic data"
    ]
  },
  "source": {
    "kind": "official-mcp-registry",
    "apiUrl": "https://registry.modelcontextprotocol.io/v0.1/servers",
    "detailUrl": "https://registry.modelcontextprotocol.io/v0.1/servers/io.github.pipeworx-io%2Ffred/versions/0.1.0",
    "status": "active",
    "publishedAt": "2026-04-22T01:32:29.102323Z",
    "updatedAt": "2026-04-22T01:32:29.102323Z",
    "retrievedAt": "2026-09-05T05:54:56.257Z"
  },
  "officialLinks": {
    "websiteUrl": "https://pipeworx.io/packs/fred",
    "repository": {
      "url": "https://github.com/pipeworx-io/mcp-fred",
      "source": "github",
      "id": null,
      "subfolder": null
    }
  },
  "transports": [
    {
      "kind": "remote",
      "type": "streamable-http",
      "url": "https://gateway.pipeworx.io/fred/mcp",
      "package": null
    }
  ],
  "authentication": {
    "mode": "none",
    "requiredHeaders": [],
    "reason": "Official Registry 声明远程端点且未要求连接请求头；无用户凭据的 initialize、tools/list 与 ask_pipeworx 显式只读调用均已通过。部分直接 FRED 工具将 API Key 作为调用参数，公共卡片已披露该能力边界。"
  },
  "license": {
    "status": "declared",
    "spdxId": "MIT",
    "evidenceUrl": "https://github.com/pipeworx-io/mcp-fred/blob/main/LICENSE"
  },
  "maintenance": {
    "registryStatus": "active",
    "registryUpdatedAt": "2026-04-22T01:32:29.102323Z",
    "ageDays": 136,
    "repositoryActivity": "unknown"
  },
  "probe": {
    "status": "pass",
    "checkedAt": "2026-09-05T05:54:56.257Z",
    "targetUrl": "https://gateway.pipeworx.io/fred/mcp",
    "httpStatus": 200,
    "reason": "MCP initialize returned a JSON-RPC or event-stream response."
  },
  "dedupe": {
    "level": "none",
    "strong": [],
    "weak": []
  },
  "score": {
    "total": 92,
    "band": "selected",
    "dimensions": {
      "authority": 23,
      "accessibility": 21,
      "maintenanceSecurity": 18,
      "runtime": 15,
      "marketGap": 10,
      "documentation": 5
    },
    "reasons": [
      "authority 23/25: Official Registry plus publisher links and namespace evidence",
      "accessibility 21/25: 1 remote and 0 package transport(s); auth none",
      "maintenance/security 18/20: status active; registry age 136 day(s); license declared",
      "runtime 15/15: public probe pass",
      "market gap 10/10: domains finance, public, research; dedupe none",
      "documentation 5/5: publisher-provided description and links"
    ],
    "gates": []
  },
  "review": {
    "decision": "approved",
    "proposedConnectorId": "fred-economic-data",
    "reviewedAt": "2026-09-05T05:55:39Z",
    "reviewedBy": "DuHu",
    "notes": "DuHu 已逐项复核 Official Registry 身份、独立或第三方维护边界、公开端点、鉴权、软件许可证或服务条款、上游数据条款提示和脱敏运行报告，批准迁入正式记录并生成 Connector 卡片。"
  },
  "runtimeAcceptance": {
    "status": "pass",
    "checkedAt": "2026-09-05T05:47:23.424Z",
    "reviewedBy": "codex-preflight",
    "reportUrl": "https://github.com/duhu2000/dsh-mcp-connector-registry/blob/main/docs/runtime-acceptance/data-mcp-batch-5/fred-economic-data.md",
    "notes": "脱敏预检通过 initialize、tools/list 和只读工具 ask_pipeworx；未保存原始响应、会话标识或凭据。维护者 DuHu 已完成来源审核。"
  },
  "evidence": [
    {
      "type": "official-registry",
      "url": "https://registry.modelcontextprotocol.io/v0.1/servers/io.github.pipeworx-io%2Ffred/versions/0.1.0",
      "collectedAt": "2026-09-05T05:54:56.257Z",
      "summary": "Official Registry status active; version 0.1.0."
    },
    {
      "type": "official-website",
      "url": "https://pipeworx.io/packs/fred",
      "collectedAt": "2026-09-05T05:54:56.257Z",
      "summary": "Publisher-provided website URL from Official Registry."
    },
    {
      "type": "official-repository",
      "url": "https://github.com/pipeworx-io/mcp-fred",
      "collectedAt": "2026-09-05T05:54:56.257Z",
      "summary": "Pipeworx 公开仓库以 MIT 发布 FRED MCP 适配器；Official Registry 提供其公共 Streamable HTTP 端点，端点同时含 Pipeworx 网关通用工具。"
    },
    {
      "type": "official-website",
      "url": "https://fred.stlouisfed.org/docs/api/terms_of_use.html",
      "collectedAt": "2026-09-05T05:55:39Z",
      "summary": "FRED API 条款要求保留来源与不背书声明；部分序列包含第三方版权内容，下载、展示和再利用必须遵守每个序列的版权说明与限制。"
    },
    {
      "type": "license",
      "url": "https://github.com/pipeworx-io/mcp-fred/blob/main/LICENSE",
      "collectedAt": "2026-09-05T05:55:39Z",
      "summary": "io.github.pipeworx-io/fred 源代码声明 MIT；上游数据授权、署名与使用条款仍需在人工批准时单独复核。"
    },
    {
      "type": "probe",
      "url": "https://gateway.pipeworx.io/fred/mcp",
      "collectedAt": "2026-09-05T05:54:56.257Z",
      "summary": "公开无用户凭据的 MCP initialize 探测通过，HTTP 200。"
    },
    {
      "type": "runtime-acceptance",
      "url": "https://github.com/duhu2000/dsh-mcp-connector-registry/blob/main/docs/runtime-acceptance/data-mcp-batch-5/fred-economic-data.md",
      "collectedAt": "2026-09-05T05:47:23.424Z",
      "summary": "自动脱敏预检通过 ask_pipeworx 只读调用；原始响应正文未落盘。"
    }
  ]
}
